{
  "$schema": "https://json-schema.org/draft/2020-12/schema",
  "$id": "https://github.com/latent-sre/save-toolkit/skills/agent-authoring/assets/fleet-improvement-v1.schema.json",
  "title": "Save Toolkit fleet improvement record v1",
  "description": "A bounded, reviewable fleet-improvement ledger record. The bundled executable validator additionally enforces legal transitions, caller-supplied authority, append-only history, cumulative reservations and actual usage, resolved evidence envelopes, exact-subject binding, path scope, and credential rejection.",
  "type": "object",
  "additionalProperties": false,
  "required": [
    "schema_version",
    "improvement_id",
    "created_at",
    "updated_at",
    "target",
    "owner",
    "related_improvement_id",
    "severity",
    "failure_fingerprint",
    "observations",
    "evidence_refs",
    "status",
    "success_criteria",
    "monitoring_plan",
    "budget",
    "attempts",
    "reviews",
    "merge",
    "monitoring",
    "rollback",
    "lesson",
    "disposition_reason",
    "limitations"
  ],
  "properties": {
    "schema_version": { "const": 1 },
    "improvement_id": { "$ref": "#/$defs/improvement_id" },
    "created_at": { "$ref": "#/$defs/timestamp" },
    "updated_at": { "$ref": "#/$defs/timestamp" },
    "target": { "$ref": "#/$defs/target" },
    "owner": { "$ref": "#/$defs/owner" },
    "related_improvement_id": {
      "oneOf": [
        { "type": "null" },
        { "$ref": "#/$defs/improvement_id" }
      ]
    },
    "severity": { "enum": ["low", "medium", "high", "critical"] },
    "failure_fingerprint": { "type": "string", "pattern": "^ff_[0-9a-f]{64}$" },
    "observations": {
      "type": "array",
      "minItems": 1,
      "items": { "$ref": "#/$defs/observation" }
    },
    "evidence_refs": {
      "type": "array",
      "minItems": 1,
      "maxItems": 64,
      "items": { "$ref": "#/$defs/evidence_ref" }
    },
    "status": {
      "enum": [
        "observed",
        "qualified",
        "candidate",
        "evaluated",
        "in_review",
        "merged",
        "monitoring",
        "closed",
        "duplicate",
        "not_reproducible",
        "not_actionable",
        "rejected",
        "blocked_pending_rescope",
        "rolled_back"
      ]
    },
    "success_criteria": {
      "type": "array",
      "minItems": 1,
      "maxItems": 64,
      "uniqueItems": true,
      "items": { "$ref": "#/$defs/nonempty" }
    },
    "monitoring_plan": { "$ref": "#/$defs/monitoring_plan" },
    "budget": { "$ref": "#/$defs/budget" },
    "attempts": {
      "type": "array",
      "maxItems": 3,
      "items": { "$ref": "#/$defs/attempt" }
    },
    "reviews": {
      "type": "array",
      "maxItems": 3,
      "items": { "$ref": "#/$defs/review" }
    },
    "merge": {
      "oneOf": [
        { "type": "null" },
        { "$ref": "#/$defs/merge" }
      ]
    },
    "monitoring": {
      "oneOf": [
        { "type": "null" },
        { "$ref": "#/$defs/monitoring" }
      ]
    },
    "rollback": {
      "oneOf": [
        { "type": "null" },
        { "$ref": "#/$defs/rollback" }
      ]
    },
    "lesson": { "$ref": "#/$defs/lesson" },
    "disposition_reason": { "$ref": "#/$defs/nonempty" },
    "limitations": {
      "type": "array",
      "maxItems": 128,
      "items": { "$ref": "#/$defs/nonempty" }
    }
  },
  "$defs": {
    "nonempty": { "type": "string", "minLength": 1, "maxLength": 4096 },
    "nullable_nonempty": {
      "oneOf": [
        { "type": "null" },
        { "$ref": "#/$defs/nonempty" }
      ]
    },
    "timestamp": {
      "type": "string",
      "format": "date-time",
      "pattern": "^\\d{4}-\\d{2}-\\d{2}T\\d{2}:\\d{2}:\\d{2}(?:\\.\\d+)?Z$"
    },
    "revision": {
      "type": "string",
      "pattern": "^(?:[0-9a-f]{40}|[0-9a-f]{64})$"
    },
    "digest": { "type": "string", "pattern": "^[0-9a-f]{64}$" },
    "evidence_id": { "type": "string", "pattern": "^ev_[0-9a-f]{32}$" },
    "improvement_id": {
      "type": "string",
      "pattern": "^fi_[a-z0-9][a-z0-9._-]{2,95}$"
    },
    "safe_path": {
      "type": "string",
      "minLength": 1,
      "maxLength": 512,
      "pattern": "^(?!\\.{1,2}(?:/|$))(?!\\.[gG][iI][tT](?:/|$))(?!.*(?:/\\.{1,2})(?:/|$))(?!.*(?:/\\.[gG][iI][tT])(?:/|$))[A-Za-z0-9._-]+(?:/[A-Za-z0-9._-]+)*$"
    },
    "target": {
      "type": "object",
      "additionalProperties": false,
      "required": ["repository", "base_revision", "artifact_kind", "artifact_paths"],
      "properties": {
        "repository": { "$ref": "#/$defs/nonempty" },
        "base_revision": { "$ref": "#/$defs/revision" },
        "artifact_kind": {
          "enum": [
            "agent",
            "skill",
            "eval",
            "grader",
            "tool_description",
            "handoff",
            "fleet_governance"
          ]
        },
        "artifact_paths": {
          "type": "array",
          "minItems": 1,
          "maxItems": 64,
          "uniqueItems": true,
          "items": { "$ref": "#/$defs/safe_path" }
        }
      }
    },
    "owner": {
      "type": "object",
      "additionalProperties": false,
      "required": ["name", "kind", "agent_lane"],
      "properties": {
        "name": { "$ref": "#/$defs/nonempty" },
        "kind": { "enum": ["human", "team"] },
        "agent_lane": { "$ref": "#/$defs/nullable_nonempty" }
      }
    },
    "observation_source": {
      "type": "object",
      "additionalProperties": false,
      "required": ["kind", "locator", "revision", "sha256"],
      "properties": {
        "kind": {
          "enum": ["user_feedback", "eval_result", "review", "runtime", "operational", "manual"]
        },
        "locator": { "$ref": "#/$defs/nonempty" },
        "revision": {
          "oneOf": [
            { "type": "null" },
            { "$ref": "#/$defs/revision" }
          ]
        },
        "sha256": {
          "oneOf": [
            { "type": "null" },
            { "$ref": "#/$defs/digest" }
          ]
        }
      }
    },
    "observation": {
      "type": "object",
      "additionalProperties": false,
      "required": [
        "event_id",
        "kind",
        "observed_at",
        "source",
        "trust",
        "summary",
        "evidence_ids"
      ],
      "properties": {
        "event_id": {
          "type": "string",
          "pattern": "^fo_[a-z0-9][a-z0-9._-]{2,95}$"
        },
        "kind": {
          "enum": [
            "user_correction",
            "eval_failure",
            "review_finding",
            "routing_misfire",
            "authority_violation",
            "runtime_drift",
            "operational_handoff",
            "manual"
          ]
        },
        "observed_at": { "$ref": "#/$defs/timestamp" },
        "source": { "$ref": "#/$defs/observation_source" },
        "trust": { "enum": ["trusted", "untrusted", "mixed"] },
        "summary": { "$ref": "#/$defs/nonempty" },
        "evidence_ids": {
          "type": "array",
          "minItems": 1,
          "maxItems": 32,
          "uniqueItems": true,
          "items": { "$ref": "#/$defs/evidence_id" }
        }
      }
    },
    "evidence_ref": {
      "type": "object",
      "additionalProperties": false,
      "required": ["evidence_id", "kind", "locator", "sha256"],
      "properties": {
        "evidence_id": { "$ref": "#/$defs/evidence_id" },
        "kind": { "enum": ["evidence_envelope", "historical_report"] },
        "locator": { "$ref": "#/$defs/safe_path" },
        "sha256": { "$ref": "#/$defs/digest" }
      }
    },
    "budget": {
      "type": "object",
      "additionalProperties": false,
      "required": [
        "origin",
        "max_attempts",
        "max_model_turns",
        "max_evaluator_calls",
        "max_tokens",
        "max_wall_seconds",
        "max_cost_usd"
      ],
      "properties": {
        "origin": { "enum": ["predeclared", "retrospective_import"] },
        "max_attempts": { "type": "integer", "minimum": 1, "maximum": 3 },
        "max_model_turns": { "type": "integer", "minimum": 1, "maximum": 60 },
        "max_evaluator_calls": { "type": "integer", "minimum": 1, "maximum": 60 },
        "max_tokens": { "type": "integer", "minimum": 1, "maximum": 1000000 },
        "max_wall_seconds": { "type": "integer", "minimum": 1, "maximum": 14400 },
        "max_cost_usd": { "type": "number", "minimum": 0, "maximum": 100 }
      }
    },
    "monitoring_plan": {
      "type": "object",
      "additionalProperties": false,
      "required": ["criterion_id", "criterion", "rollback_triggers"],
      "properties": {
        "criterion_id": {
          "type": "string",
          "pattern": "^fm_[a-z0-9][a-z0-9._-]{2,95}$"
        },
        "criterion": { "$ref": "#/$defs/nonempty" },
        "rollback_triggers": {
          "type": "array",
          "minItems": 1,
          "maxItems": 6,
          "uniqueItems": true,
          "items": {
            "enum": [
              "monitoring_fail",
              "monitoring_inconclusive",
              "security_finding",
              "authority_revoked",
              "merge_error",
              "manual_owner_decision"
            ]
          }
        }
      }
    },
    "author": {
      "type": "object",
      "additionalProperties": false,
      "required": ["name", "role"],
      "properties": {
        "name": { "$ref": "#/$defs/nonempty" },
        "role": { "$ref": "#/$defs/nonempty" }
      }
    },
    "usage": {
      "type": "object",
      "additionalProperties": false,
      "required": ["model_turns", "evaluator_calls", "tokens", "wall_seconds", "cost_usd"],
      "properties": {
        "model_turns": { "type": "integer", "minimum": 0 },
        "evaluator_calls": { "type": "integer", "minimum": 0 },
        "tokens": { "type": "integer", "minimum": 0 },
        "wall_seconds": { "type": "integer", "minimum": 0 },
        "cost_usd": { "type": "number", "minimum": 0 }
      }
    },
    "visible_case_set": {
      "type": "object",
      "additionalProperties": false,
      "required": ["sha256", "case_count"],
      "properties": {
        "sha256": { "$ref": "#/$defs/digest" },
        "case_count": { "type": "integer", "minimum": 1 }
      }
    },
    "shadow": {
      "type": "object",
      "additionalProperties": false,
      "required": ["sha256", "case_count", "result", "evidence_id"],
      "properties": {
        "sha256": { "$ref": "#/$defs/digest" },
        "case_count": { "type": "integer", "minimum": 1 },
        "result": { "enum": ["pass", "fail", "inconclusive"] },
        "evidence_id": { "$ref": "#/$defs/evidence_id" }
      }
    },
    "case_sets": {
      "type": "object",
      "additionalProperties": false,
      "required": ["calibration", "regression", "shadow"],
      "properties": {
        "calibration": { "$ref": "#/$defs/visible_case_set" },
        "regression": { "$ref": "#/$defs/visible_case_set" },
        "shadow": {
          "oneOf": [
            { "type": "null" },
            { "$ref": "#/$defs/shadow" }
          ]
        }
      }
    },
    "evaluation": {
      "type": "object",
      "additionalProperties": false,
      "required": [
        "kind",
        "evaluator",
        "evidence_id",
        "locator",
        "sha256",
        "subject_revision",
        "evaluator_revision",
        "runner_sha256",
        "suite_sha256",
        "case_set_sha256",
        "requested_model",
        "observed_model",
        "reasoning_mode",
        "trial_count",
        "result",
        "safety_regression",
        "authority_regression"
      ],
      "properties": {
        "kind": { "enum": ["evidence_envelope", "historical_report"] },
        "evaluator": {
          "oneOf": [
            { "type": "null" },
            { "$ref": "#/$defs/nonempty" }
          ]
        },
        "evidence_id": {
          "oneOf": [
            { "type": "null" },
            { "$ref": "#/$defs/evidence_id" }
          ]
        },
        "locator": { "$ref": "#/$defs/nonempty" },
        "sha256": { "$ref": "#/$defs/digest" },
        "subject_revision": {
          "oneOf": [
            { "type": "null" },
            { "$ref": "#/$defs/revision" }
          ]
        },
        "evaluator_revision": { "$ref": "#/$defs/revision" },
        "runner_sha256": {
          "oneOf": [
            { "type": "null" },
            { "$ref": "#/$defs/digest" }
          ]
        },
        "suite_sha256": {
          "oneOf": [
            { "type": "null" },
            { "$ref": "#/$defs/digest" }
          ]
        },
        "case_set_sha256": {
          "oneOf": [
            { "type": "null" },
            { "$ref": "#/$defs/digest" }
          ]
        },
        "requested_model": { "$ref": "#/$defs/nonempty" },
        "observed_model": { "$ref": "#/$defs/nonempty" },
        "reasoning_mode": { "$ref": "#/$defs/nonempty" },
        "trial_count": { "type": "integer", "minimum": 1 },
        "result": { "enum": ["pass", "fail", "skip", "inconclusive"] },
        "safety_regression": { "type": "boolean" },
        "authority_regression": { "type": "boolean" }
      }
    },
    "attempt": {
      "type": "object",
      "additionalProperties": false,
      "required": [
        "attempt_id",
        "iteration",
        "parent_revision",
        "subject_revision",
        "subject_sha256",
        "change_summary",
        "author",
        "reservation",
        "actual_usage",
        "case_sets",
        "evaluation",
        "outcome",
        "stop_reason"
      ],
      "properties": {
        "attempt_id": {
          "type": "string",
          "pattern": "^fa_[a-z0-9][a-z0-9._-]{2,95}$"
        },
        "iteration": { "type": "integer", "minimum": 1, "maximum": 3 },
        "parent_revision": { "$ref": "#/$defs/revision" },
        "subject_revision": {
          "oneOf": [
            { "type": "null" },
            { "$ref": "#/$defs/revision" }
          ]
        },
        "subject_sha256": {
          "oneOf": [
            { "type": "null" },
            { "$ref": "#/$defs/digest" }
          ]
        },
        "change_summary": { "$ref": "#/$defs/nonempty" },
        "author": { "$ref": "#/$defs/author" },
        "reservation": {
          "oneOf": [
            { "type": "null" },
            { "$ref": "#/$defs/usage" }
          ]
        },
        "actual_usage": {
          "oneOf": [
            { "type": "null" },
            { "$ref": "#/$defs/usage" }
          ]
        },
        "case_sets": { "$ref": "#/$defs/case_sets" },
        "evaluation": {
          "oneOf": [
            { "type": "null" },
            { "$ref": "#/$defs/evaluation" }
          ]
        },
        "outcome": {
          "enum": ["proposed", "pass", "fail", "skip", "inconclusive", "rejected", "superseded"]
        },
        "stop_reason": { "$ref": "#/$defs/nullable_nonempty" }
      }
    },
    "review": {
      "type": "object",
      "additionalProperties": false,
      "required": [
        "attempt_id",
        "subject_revision",
        "reviewer",
        "verdict",
        "evidence_id",
        "locator",
        "evidence_sha256",
        "reviewed_at"
      ],
      "properties": {
        "attempt_id": {
          "type": "string",
          "pattern": "^fa_[a-z0-9][a-z0-9._-]{2,95}$"
        },
        "subject_revision": { "$ref": "#/$defs/revision" },
        "reviewer": { "$ref": "#/$defs/nonempty" },
        "verdict": { "enum": ["pass", "changes_requested"] },
        "evidence_id": { "$ref": "#/$defs/evidence_id" },
        "locator": { "$ref": "#/$defs/nonempty" },
        "evidence_sha256": { "$ref": "#/$defs/digest" },
        "reviewed_at": { "$ref": "#/$defs/timestamp" }
      }
    },
    "merge": {
      "type": "object",
      "additionalProperties": false,
      "required": ["pr_url", "subject_revision", "merge_revision", "merged_at", "merged_by"],
      "properties": {
        "pr_url": { "$ref": "#/$defs/nonempty" },
        "subject_revision": { "$ref": "#/$defs/revision" },
        "merge_revision": { "$ref": "#/$defs/revision" },
        "merged_at": { "$ref": "#/$defs/timestamp" },
        "merged_by": { "$ref": "#/$defs/nonempty" }
      }
    },
    "monitoring": {
      "type": "object",
      "additionalProperties": false,
      "required": [
        "subject_revision",
        "criterion_id",
        "observed_by",
        "observed_at",
        "result",
        "evidence_ids"
      ],
      "properties": {
        "subject_revision": { "$ref": "#/$defs/revision" },
        "criterion_id": {
          "type": "string",
          "pattern": "^fm_[a-z0-9][a-z0-9._-]{2,95}$"
        },
        "observed_by": { "$ref": "#/$defs/nonempty" },
        "observed_at": { "$ref": "#/$defs/timestamp" },
        "result": { "enum": ["pass", "fail", "inconclusive"] },
        "evidence_ids": {
          "type": "array",
          "minItems": 1,
          "uniqueItems": true,
          "items": { "$ref": "#/$defs/evidence_id" }
        }
      }
    },
    "rollback": {
      "type": "object",
      "additionalProperties": false,
      "required": [
        "subject_revision",
        "merge_revision",
        "rollback_revision",
        "rolled_back_at",
        "rolled_back_by",
        "trigger",
        "reason",
        "evidence_ids"
      ],
      "properties": {
        "subject_revision": { "$ref": "#/$defs/revision" },
        "merge_revision": { "$ref": "#/$defs/revision" },
        "rollback_revision": { "$ref": "#/$defs/revision" },
        "rolled_back_at": { "$ref": "#/$defs/timestamp" },
        "rolled_back_by": { "$ref": "#/$defs/nonempty" },
        "trigger": {
          "enum": [
            "monitoring_fail",
            "monitoring_inconclusive",
            "security_finding",
            "authority_revoked",
            "merge_error",
            "manual_owner_decision"
          ]
        },
        "reason": { "$ref": "#/$defs/nonempty" },
        "evidence_ids": {
          "type": "array",
          "minItems": 1,
          "uniqueItems": true,
          "items": { "$ref": "#/$defs/evidence_id" }
        }
      }
    },
    "lesson": {
      "type": "object",
      "additionalProperties": false,
      "required": ["status", "control_path", "reason"],
      "properties": {
        "status": { "enum": ["pending", "encoded", "not_applicable"] },
        "control_path": {
          "oneOf": [
            { "type": "null" },
            { "$ref": "#/$defs/safe_path" }
          ]
        },
        "reason": { "$ref": "#/$defs/nonempty" }
      }
    }
  }
}
